{
  "$schema": "https://json-schema.org/draft/2020-12/schema",
  "$id": "https://panoptes.wargame/contracts/v1/inject_schema.json",
  "$comment": "DRAFT until a human deletes this line.",
  "title": "Replay file: injects and ground truth",
  "description": "The format for a scenario or replay. An inject is one piece of information arriving at named seats at a named sim time, with a confidence and a source; ground truth is what was actually happening, used only for scoring and never shown to a seat. A file may hold injects, ground truth, or both, so eval/replays can keep them in separate files (inject timeline authored openly, ground truth held apart) or one. Files under eval/replays/ are quarantine material per docs/quarantine.md: engine/injects.py loads them, and nothing in specs/, gen/ or the lake may read them.",
  "type": "object",
  "additionalProperties": false,
  "required": ["replay_id", "replay_version"],
  "anyOf": [
    { "required": ["injects"] },
    { "required": ["ground_truth"] }
  ],
  "properties": {
    "replay_id": {
      "type": "string",
      "pattern": "^[a-z0-9]+(?:_[a-z0-9]+)*$",
      "description": "Stable id for the scenario or replay, e.g. 'kosmos_2558', 'control_galaxy_15', 'devset_storm_only'."
    },
    "replay_version": {
      "type": "string",
      "pattern": "^v[0-9]+$",
      "description": "Bumped whenever an inject's time, content or confidence changes. A run records the version it used."
    },
    "kind": {
      "type": "string",
      "enum": ["real_replay", "control", "devset", "synthetic"],
      "description": "real_replay and control are quarantine material run once by Agent 6. devset and synthetic are the iteration set and are safe for Agents 3-5."
    },
    "title": { "type": "string", "maxLength": 200 },
    "description": { "type": "string", "maxLength": 4000, "description": "What this scenario is and what it is testing." },
    "duration_s": { "type": "number", "minimum": 0, "maximum": 2592000, "description": "Episode length in sim seconds. 259200 for the standard 72-hour episode." },
    "injects": {
      "type": "array",
      "minItems": 1,
      "items": { "$ref": "#/$defs/inject" },
      "description": "The inject timeline, ordered by sim_time_s. Only what was publicly or privately knowable at that moment, to the seats that could know it."
    },
    "ground_truth": { "$ref": "#/$defs/ground_truth" }
  },
  "$defs": {
    "inject": {
      "type": "object",
      "additionalProperties": false,
      "required": ["sim_time_s", "recipients", "content", "confidence", "source"],
      "properties": {
        "sim_time_s": {
          "type": "number",
          "minimum": 0,
          "description": "When this information reaches the recipients, in seconds from episode start. Already includes real-world reporting delay; the engine adds each seat's per-feed latency on top."
        },
        "recipients": {
          "type": "array",
          "minItems": 1,
          "uniqueItems": true,
          "description": "Who sees it. 'all' delivers to every seat. Restricting recipients is how the scenario creates the information asymmetry the whole exercise turns on.",
          "items": {
            "oneOf": [
              { "$ref": "spec_schema.json#/$defs/actor" },
              { "type": "string", "enum": ["all"] }
            ]
          }
        },
        "content": {
          "type": "string",
          "minLength": 1,
          "maxLength": 4000,
          "description": "The text as the recipient sees it: a report, a bulletin, an OSINT post, a customer complaint. Written from the feed's point of view, not the author's; it may be wrong, and often should be."
        },
        "confidence": {
          "type": "number",
          "minimum": 0,
          "maximum": 1,
          "description": "How confident the source is in its own content, 0 to 1. The engine multiplies this by the recipient's feed confidence_scale and by the storm layer's sensor_confidence multiplier. Rough anchors for authors: 0.2 rumour, 0.5 single unconfirmed report, 0.75 corroborated, 0.95 direct measurement."
        },
        "source": {
          "type": "string",
          "minLength": 1,
          "maxLength": 200,
          "description": "The originating feed or organisation as named to the recipient, e.g. 'NOAA SWPC bulletin', 'KSAT operations', 'social media', 'liaison, Norwegian Intelligence Service'."
        },
        "inject_id": {
          "type": "string",
          "pattern": "^[a-z0-9]+(?:[_-][a-z0-9]+)*$",
          "description": "Optional but recommended: stable id, echoed into the event log as payload.inject_id and used by eval to compute belief lag against a specific inject."
        },
        "feed": {
          "type": "string",
          "pattern": "^[a-z0-9]+(?:_[a-z0-9]+)*$",
          "description": "Optional. Which of the recipient's spec feeds this arrives on. If set, a recipient whose spec does not list that feed never receives the inject."
        },
        "source_class": {
          "type": "string",
          "enum": ["osint", "sigint", "commercial_telemetry", "space_weather", "media", "diplomatic", "liaison", "internal", "customer"],
          "description": "Optional machine-readable source category, for reporting and for the judge's private_info dimension."
        },
        "source_url": {
          "type": "string",
          "format": "uri",
          "description": "Optional. For replay authors: the public record this inject is drawn from, so a human can verify the date and the claim."
        },
        "truthful": {
          "type": "boolean",
          "description": "Optional, default true. False marks an inject that is wrong or deliberately misleading. Never shown to a seat; used only when scoring whether a persona was correctly sceptical."
        },
        "is_knife_inject": {
          "type": "boolean",
          "description": "Optional, default false. Marks the decision point the demo freezes on and the one counterfactual_sensitivity in contracts/targets.md is measured at. At most one per file."
        }
      }
    },
    "cause": {
      "type": "string",
      "description": "What was actually happening. 'unknown' is a real answer and the right one for an unresolved incident.",
      "enum": [
        "natural_space_weather",
        "technical_failure",
        "debris_or_collision",
        "hostile_jam",
        "hostile_dazzle",
        "hostile_ground_cyber",
        "hostile_rpo",
        "hostile_kinetic",
        "hostile_terrestrial",
        "multiple",
        "unknown"
      ]
    },
    "ground_truth": {
      "type": "object",
      "additionalProperties": false,
      "required": ["cause", "attribution_time_s", "real_responses", "notes"],
      "description": "Scoring key. Never delivered to any seat, never in a prompt, never in the lake. The engine loads it only to emit the attribution_revealed line at episode end.",
      "properties": {
        "cause": { "$ref": "#/$defs/cause" },
        "responsible_actor": {
          "description": "Who did it. 'none' is the control answer: nobody did, it was the environment or the hardware. null means the public record does not establish it.",
          "oneOf": [
            { "$ref": "spec_schema.json#/$defs/actor" },
            { "type": "string", "enum": ["none"] },
            { "type": "null" }
          ]
        },
        "attribution_time_s": {
          "description": "Sim seconds from episode start at which the cause became publicly established in reality. null means it never was, which is the correct and common value for an unresolved incident. eval/replay_table.py compares the population's belief crossing against this.",
          "oneOf": [
            { "type": "number", "minimum": 0 },
            { "type": "null" }
          ]
        },
        "real_responses": {
          "type": "object",
          "description": "What the real counterpart of each seat actually did, keyed by seat. A seat absent from this map made no recorded response, which is itself informative: response_match in contracts/targets.md scores 'hold' against an absent seat. Values may be a bare action name or an object carrying when and by whom.",
          "propertyNames": { "$ref": "spec_schema.json#/$defs/seat" },
          "additionalProperties": {
            "oneOf": [
              { "$ref": "action_schema.json#/$defs/action_type" },
              {
                "type": "object",
                "additionalProperties": false,
                "required": ["action"],
                "properties": {
                  "action": { "$ref": "action_schema.json#/$defs/action_type" },
                  "sim_time_s": { "type": "number", "minimum": 0 },
                  "real_actor": { "type": "string", "description": "The real-world organisation or person the seat stands in for in this incident." },
                  "notes": { "type": "string", "maxLength": 1000 },
                  "source_url": { "type": "string", "format": "uri" }
                }
              }
            ]
          }
        },
        "notes": {
          "type": "string",
          "maxLength": 8000,
          "description": "What the public record does and does not establish, what is contested, and what the scoring should therefore not penalise. Required: an empty string is allowed but a lazy one wastes the replay."
        },
        "expected_beliefs": {
          "type": "object",
          "description": "Optional. For devset scenarios with known correct behaviour: the belief band a competent seat should hold by the end, keyed by seat, as {hostile_min, hostile_max}. train/devset.py scores against it.",
          "propertyNames": { "$ref": "spec_schema.json#/$defs/seat" },
          "additionalProperties": {
            "type": "object",
            "additionalProperties": false,
            "properties": {
              "hostile_min": { "type": "number", "minimum": 0, "maximum": 1 },
              "hostile_max": { "type": "number", "minimum": 0, "maximum": 1 },
              "expected_attributed_actor": {
                "oneOf": [
                  { "$ref": "spec_schema.json#/$defs/actor" },
                  { "type": "string", "enum": ["none", "unknown"] },
                  { "type": "null" }
                ]
              }
            }
          }
        },
        "forbidden_actions": {
          "type": "array",
          "uniqueItems": true,
          "items": { "$ref": "action_schema.json#/$defs/action_type" },
          "description": "Optional. Actions no seat should take in this scenario because reality had none. Feeds irreversible_action_rate_replays in contracts/targets.md."
        }
      }
    }
  }
}
