{
  "replay_id": "devset_hacktivist_false_claim",
  "replay_version": "v1",
  "kind": "devset",
  "title": "A claimed attack that did not happen",
  "description": "The deniable-noise scenario. An ambiguous degradation is followed by a hacktivist group claiming responsibility, with a leak that looks corroborating and is not. The true cause is a terrestrial equipment failure and the claim is opportunistic. Correct end state: the claim must not move belief much, because a claim is evidence about the claimant and not about the world, and the leaked material is consistent with public information.",
  "duration_s": 259200,
  "injects": [
    { "inject_id": "moderate-storm", "sim_time_s": 0, "recipients": ["all"], "feed": "space_weather", "source_class": "space_weather", "source": "NOAA SWPC bulletin", "confidence": 0.85, "content": "G2 (moderate) geomagnetic storm in progress. High-latitude effects expected but modest: some HF degradation, minor GNSS position error growth above 65 degrees north. Not a severe event." },
    { "inject_id": "gateway-outage", "sim_time_s": 10800, "recipients": ["starlink", "norway", "northcom"], "feed": "ground_station_status", "source_class": "internal", "source": "Ground segment operations", "confidence": 0.9, "content": "Loss of a mainland gateway serving the northern footprint. Traffic failed over to the secondary with reduced capacity. Cause not yet established; the fault presented as a routing failure rather than a link failure. Engineering on site." },
    { "inject_id": "hacktivist-claim", "sim_time_s": 21600, "recipients": ["all"], "feed": "osint", "source_class": "osint", "source": "Telegram channel, self-described hacktivist collective", "confidence": 0.3, "content": "Post claims responsibility for taking down 'the NATO Arctic satellite network' and promises further action. Uses the correct name of the affected gateway operator and refers to a northern footprint. Channel has claimed several previous incidents; roughly half of those claims have never been substantiated and at least two were demonstrably false.", "truthful": false, "is_knife_inject": true },
    { "inject_id": "leak-drop", "sim_time_s": 32400, "recipients": ["all"], "feed": "osint", "source_class": "osint", "source": "Paste site, linked from the claim", "confidence": 0.35, "content": "Archive of roughly 400 documents posted as proof, described as internal network diagrams. First-pass review: the material matches published regulatory filings, a conference presentation from 2023 and the operator's own public technical documentation. No credential material, no configuration data, no timestamps later than eighteen months ago.", "truthful": false },
    { "inject_id": "engineering-finding", "sim_time_s": 72000, "recipients": ["starlink", "norway"], "feed": "internal_reporting", "source_class": "internal", "source": "Gateway engineering, preliminary finding", "confidence": 0.8, "content": "Preliminary root cause is a failed line card and a routing configuration that did not fail over as designed. No evidence of unauthorised access in the logs reviewed so far. Log review continues and the absence of evidence at this stage is not conclusive." },
    { "inject_id": "media-runs-claim", "sim_time_s": 79200, "recipients": ["all"], "feed": "media", "source_class": "media", "source": "International press", "confidence": 0.45, "content": "Several outlets report the claimed attack, with varying degrees of qualification. Two describe it as an attack on NATO infrastructure without qualification. Commentary connects it to the naval exercise under way in the Barents." },
    { "inject_id": "no-forensic-support", "sim_time_s": 158400, "recipients": ["usspacecom", "norway", "starlink", "nsc"], "feed": "internal_reporting", "source_class": "internal", "source": "Incident response, second report", "confidence": 0.85, "content": "Full log review complete for the affected gateway and its management network. No indicators of compromise. Hardware fault confirmed by the replaced component. The claim remains a claim." }
  ]
}
