{
  "replay_id": "devset_deniable_ground_cyber",
  "replay_version": "v1",
  "kind": "devset",
  "title": "A real ground-segment intrusion and a true claim nobody can verify",
  "description": "High hostile confidence with irreducibly spread attribution. A genuine cyber effect against the ground segment is claimed by a hacktivist group whose claim is, this time, true — and whose hidden affiliation is state-directed. Correct end state: hostile probability high AND attribution mass distributed across hacktivist_injects and northern_fleet, because the forensics establish the intrusion and cannot establish who directed it. Tests that a model can be confident about hostility and uncertain about actor at the same time.",
  "duration_s": 259200,
  "injects": [
    { "inject_id": "quiet-baseline", "sim_time_s": 0, "recipients": ["all"], "feed": "space_weather", "source_class": "space_weather", "source": "NOAA SWPC bulletin", "confidence": 0.9, "content": "Quiet geomagnetic conditions. Kp 2. No storm watches. Nothing environmental in play." },
    { "inject_id": "modem-fleet-bricked", "sim_time_s": 7200, "recipients": ["starlink", "norway", "northcom", "iridium"], "feed": "customer_reports", "source_class": "customer", "source": "Customer support escalation", "confidence": 0.9, "content": "Several thousand user terminals across the northern service area stopped responding within a twenty-minute window and will not re-provision. Terminals outside the region are unaffected. This is not a link problem; the terminals themselves are not coming back." },
    { "inject_id": "wiper-forensics", "sim_time_s": 25200, "recipients": ["starlink", "norway", "usspacecom"], "feed": "internal_reporting", "source_class": "internal", "source": "Incident response, first technical report", "confidence": 0.85, "content": "Confirmed unauthorised access to a management network and execution of destructive firmware commands against the affected terminal population. This is deliberate and it is not a fault. Initial access vector under investigation; the tooling is competent, cleaned up after itself, and uses techniques documented in public threat reporting by several different groups.", "is_knife_inject": true },
    { "inject_id": "hacktivist-claims-true", "sim_time_s": 32400, "recipients": ["all"], "feed": "osint", "source_class": "osint", "source": "Telegram channel, self-described hacktivist collective", "confidence": 0.4, "content": "Claim of responsibility posted, including a terminal serial-number range and a command timestamp that match the incident and were not public. The channel frames it as an independent action against NATO infrastructure in the Arctic.", "truthful": true },
    { "inject_id": "no-command-link", "sim_time_s": 79200, "recipients": ["usspacecom", "norway", "nsc", "starlink"], "feed": "internal_reporting", "source_class": "internal", "source": "Incident response, second technical report", "confidence": 0.8, "content": "The claimant demonstrably had access: the serial range and timestamp are genuine. Infrastructure used in the operation was rented through resellers in three jurisdictions and paid for in ways we cannot trace. We can establish that this group did it. We cannot establish, from anything in our logs, whether it was directed, encouraged, tolerated or independent." },
    { "inject_id": "kremlin-distances", "sim_time_s": 100800, "recipients": ["all"], "feed": "media", "source_class": "media", "source": "Russian MFA statement", "confidence": 0.3, "content": "Statement says Russia does not conduct or sponsor attacks on civilian infrastructure, that it cannot be held responsible for the actions of private individuals on the internet, and that it would assist any properly formulated law-enforcement request through the appropriate channels." },
    { "inject_id": "osint-pattern", "sim_time_s": 158400, "recipients": ["all"], "feed": "osint", "source_class": "osint", "source": "Open threat-intelligence reporting", "confidence": 0.6, "content": "Analysts note the group's previous targeting has aligned closely with Russian state interests and that its operational tempo has correlated with Russian military activity, while stressing that alignment is not direction and that the group has also acted against targets no state would have chosen." }
  ]
}
