{
  "replay_id": "devset_dazzle_then_denial",
  "replay_version": "v1",
  "kind": "devset",
  "title": "An imaging payload is dazzled, and the record is disputed",
  "description": "Attribution is reachable but contested. An optical payload takes sensor damage over a known geographic footprint during quiet space weather; the evidence is good; the responsible party denies it in a statement that is accurate in every particular and false in aggregate. Correct end state: hostile high and attribution to northern_fleet, with the denial having little effect on belief, and no irreversible response to a reversible-by-design effect.",
  "duration_s": 259200,
  "injects": [
    { "inject_id": "quiet-conditions", "sim_time_s": 0, "recipients": ["all"], "feed": "space_weather", "source_class": "space_weather", "source": "NOAA SWPC bulletin", "confidence": 0.9, "content": "Quiet geomagnetic conditions, Kp 1-2. No solar events of note. Nothing in the environment that would affect optical payload performance." },
    { "inject_id": "sensor-anomaly", "sim_time_s": 9000, "recipients": ["norway", "usspacecom"], "feed": "own_telemetry", "source_class": "internal", "source": "ASBM payload operations", "confidence": 0.95, "content": "Imaging payload returned saturated frames across a 90-second segment of a descending pass over the Barents. Saturation is confined to that segment, the affected detector region matches the boresight track, and housekeeping shows no bus anomaly. Frames either side of the segment are nominal." },
    { "inject_id": "geometry-analysis", "sim_time_s": 19800, "recipients": ["usspacecom", "norway"], "feed": "sigint", "source_class": "sigint", "source": "Technical analysis, combined", "confidence": 0.85, "content": "Saturation window maps to a ground footprint of roughly 40 km centred on a site on the Kola coast. Spectral character of the residual signal is consistent with a ground-based laser in a band used for optical tracking and dazzling. No natural source produces this signature during quiet conditions; there is no sun-glint geometry at this local time.", "is_knife_inject": true },
    { "inject_id": "second-pass-repeat", "sim_time_s": 36000, "recipients": ["norway", "usspacecom", "northcom"], "feed": "own_telemetry", "source_class": "internal", "source": "ASBM payload operations", "confidence": 0.95, "content": "The effect repeated on the next pass over the same footprint, with the same duration and the same detector region. Two passes, same geometry, same signature. Post-event detector calibration shows a small permanent responsivity loss in the affected region." },
    { "inject_id": "kremlin-statement", "sim_time_s": 61200, "recipients": ["all"], "feed": "media", "source_class": "media", "source": "Russian MFA statement", "confidence": 0.3, "content": "Statement notes that Russia operates optical tracking facilities on its own territory for space situational awareness, as do many states including the complainants; that such facilities are lawful and their operation is not directed at any party; that no Russian system is designed to damage foreign spacecraft; and that a satellite operator experiencing a detector fault should consider its own hardware before making accusations. Every clause is individually accurate." },
    { "inject_id": "china-notes-record", "sim_time_s": 86400, "recipients": ["all"], "feed": "adversary_public_statements", "source_class": "diplomatic", "source": "Chinese MFA statement", "confidence": 0.5, "content": "Statement observes that several states operate ground-based optical systems capable of affecting spacecraft sensors, urges restraint, and declines to comment on the specific incident pending publication of technical evidence." },
    { "inject_id": "no-repeat", "sim_time_s": 158400, "recipients": ["norway", "usspacecom"], "feed": "own_telemetry", "source_class": "internal", "source": "ASBM payload operations", "confidence": 0.9, "content": "No further events across six subsequent passes over the same footprint. Residual responsivity loss is stable and within the payload's degradation allowance; imaging capability is reduced, not lost." }
  ]
}
