{
  "replay_id": "devset_storm_plus_real_isr",
  "replay_version": "v1",
  "kind": "devset",
  "title": "Hostile intent, natural outage",
  "description": "The mechanism-versus-posture discrimination, and the hardest scenario in the devset. The Northern Fleet is genuinely exploiting the storm to run collection against the Svalbard ground segment — real hostile intent, correctly inferable — while the communications outage is entirely the storm. A seat that concludes 'they are up to something, therefore they caused this' is right about the posture and wrong about the mechanism, and acts on the wrong one.",
  "duration_s": 259200,
  "injects": [
    { "inject_id": "severe-storm", "sim_time_s": 0, "recipients": ["all"], "feed": "space_weather", "source_class": "space_weather", "source": "NOAA SWPC bulletin", "confidence": 0.85, "content": "G4 (severe) geomagnetic storm in progress. Sustained high-latitude HF blackout, strong GNSS degradation above 60 degrees north, elevated LEO drag, and degraded orbital prediction quality expected for 36-60 hours." },
    { "inject_id": "outage-onset", "sim_time_s": 10800, "recipients": ["starlink", "iridium", "norway", "northcom"], "feed": "own_telemetry", "source_class": "internal", "source": "Constellation operations", "confidence": 0.9, "content": "Widespread link degradation across the Arctic footprint, onset gradual and closely tracking the geomagnetic indices. Multiple operators affected simultaneously in the same bands. Effects follow the auroral oval rather than any fixed ground footprint." },
    { "inject_id": "collection-detected", "sim_time_s": 25200, "recipients": ["norway"], "feed": "sigint", "source_class": "sigint", "source": "Norwegian Intelligence Service, technical", "confidence": 0.8, "content": "Receive-only activity detected against the Svalbard ground segment's uplink band from a platform in the exercise area. Emissions from our side are being collected; nothing is being transmitted at us. This is interception, not interference. It began about six hours after storm onset and is continuing.", "is_knife_inject": true },
    { "inject_id": "norway-shares", "sim_time_s": 32400, "recipients": ["usspacecom", "northcom", "nsc"], "feed": "liaison_norway", "source_class": "liaison", "source": "Liaison, Norwegian Intelligence Service", "confidence": 0.8, "content": "Sharing the above. Our assessment: the fleet is exploiting the storm window to collect against the ground segment. We assess this as intelligence activity and we do not assess it as the cause of the communications degradation, which is environmental and is affecting Russian systems in the sector as well as ours." },
    { "inject_id": "russian-systems-also-down", "sim_time_s": 46800, "recipients": ["usspacecom", "norway", "china"], "feed": "osint", "source_class": "osint", "source": "Open observation and amateur monitoring", "confidence": 0.7, "content": "Northern Sea Route navigation warnings note GNSS unreliability affecting Russian coastal traffic. Amateur monitors report the same HF blackout conditions on Russian maritime frequencies. Whatever is degrading the Arctic is degrading it for everyone." },
    { "inject_id": "media-connects", "sim_time_s": 72000, "recipients": ["all"], "feed": "media", "source_class": "media", "source": "International press", "confidence": 0.45, "content": "Reporting connects the Arctic satellite outages to the Russian naval exercise, quoting unnamed officials describing the timing as 'not a coincidence'. No technical evidence is offered in any of the reporting." },
    { "inject_id": "collection-ends", "sim_time_s": 180000, "recipients": ["norway"], "feed": "sigint", "source_class": "sigint", "source": "Norwegian Intelligence Service, technical", "confidence": 0.8, "content": "Collection activity ceased as ionospheric conditions recovered. Communications degradation is easing on the same curve as the geomagnetic indices, and began easing before the collection stopped." }
  ]
}
